,Sentence,Tokenized,Class,Label
396," — zákon o ochrane pred legalizáciou príjmov z trestnej činnosti ao ochrane pred financovaním terorizmu a o zmene a doplnení niektorých zákonov v platnom znení, a tvorí prílohu k návrhu na zápis pvs do registra pvs / overenie identifikácie kuv pvs"," — zákon ochrane legalizácia príjem trestný činnosť ao ochrane financovaním terorizmus zmena doplnení zákon platnom znení , tvoriť prílohu návrh zápis pvs register pvs / overenie identifikácie kuv pvs ",majitel,0
397," — zákon o registri pvs a o zmene a doplnení niektorých zákonov v platnom znení (ďalej len „zákon“) pri overovaní identifikácie kuv koná nestranne a s odbornou starostlivosťou, zaobstará si o predmete zápisu do registra pvs (ďalej len „register“) všetky dostupné informácie a tieto vyhodnotí postupom podľa zákona č"," — zákon registri pvs zmena doplnení zákon platnom znení ( ďalej „ zákon “ ) overovaní identifikácie kuv koná nestranne odborný starostlivosťou , zaobstará predmete zápisu register pvs ( ďalej „ register “ ) dostupné informácia vyhodnotí postupom zákon č ",majitel,0
398," sídlo: suché mýto 1, 811 03 bratislava ičo: 47 132 990 zapísaný: v obchodnom registri okresného súdu bratislava i, oddiel: sro, vložka číslo: 88777/b vmkuv kuv, konateľ spoločnosti (ďalej len „pvs“ a/alebo „pvs“) a- 1 odôvodnenie na základe akých informácií a postupom podľa $11, ods"," sídlo : suché mýto 1 , 811 03 bratislava ičo : 47 132 990 zapísaný : obchodnom registri okresného súd bratislava , oddiel : sro , vložka číslo : 88777/b vmkuv kuv , konateľ spoločnosť ( ďalej „ pvs “ a/alebo „ pvs “ ) a- 1 odôvodnenie základ aký informácia postupom $11 , ods ",majitel,0
399, 5 zákona os preukazuje a odôvodňuje overenie identifikácie kuv / kuv (ďalej len „kúv“) na základe nižšie uvedených podkladov a informácií: 1) výpis z obchodného registra pvs zo dňa 22, 5 zákon os preukazuje odôvodňuje overenie identifikácie kuv / kuv ( ďalej „ kúv “ ) základ nízko uvedený podkladov informácia : 1 ) výpis obchodný register pvs deň 22 ,majitel,0
400,"1984, rodné číslo: 840614/6089, štátny občan slovenskej republiky (ďalej len ako „ kuv“), ktorý sa na základnom imaní pvs podieľa peňažným vkladom vo výške 5","1984 , rodné číslo : 840614/6089 , štátny občan slovenský republika ( ďalej „ kuv “ ) , základnom imaní pvs podieľať peňažným vkladom výška 5 ",majitel,0
401," vmkuv / konatelia — riadiaci orgán pvs riadiacim orgánom pvs je vmkuv zložený z jedného konateľa, ktorým je pán kuv, ktorého konanie za pvs je upravené nasledovne: „za spoločnosť koná a podpisuje konateľ samostatne“ b"," vmkuv / konatelia — riadiaci orgán pvs riadiacim orgánom pvs byť vmkuv zložený jeden konateľa , byť pán kuv , konanie pvs byť upravený nasledovne : „ spoločnosť koná podpisuje konateľ samostatne “ b ",majitel,0
402, identifikácia kuv na základe informácií a podkladov os identifikovala kuv pvs v súlade so zákonom a v súlade s ustanovením $ 6a č, identifikácia kuv základ informácia podkladov os identifikovala kuv pvs súlad zákon súlad ustanovenie $ 6a č ,majitel,0
403," — zákon o ochrane pred legalizáciou príjmov z trestnej činnosti a o ochrane pred financovaním terorizmu a o zmene a doplnení niektorých zákonov v platnom znení, ako kuv pvs nasledovné osoby: konečný užívateľ výho meno a priezvisko: kuv trvale bytom: znievska 32, 851 06 bratislava dátum narodenia: 14"," — zákon ochrane legalizácia príjem trestný činnosť ochrane financovaním terorizmus zmena doplnení zákon platnom znení , kuv pvs nasledovné osoba : konečný užívateľ výho meno priezvisko : kuv trvale bytom : znievska 32 , 851 06 bratislava dátum narodenie : 14 ",majitel,0
404,"1984, rodné číslo: 840614/6089, štátny občan slovenskej republiky (ďalej len ako „» kuv“), ktorý sa na základnom imaní pvs podieľa peňažným vkladom vo výške 5"," — obchodný zákonník platnom znení — zmluva tichom spoločenstvo , 2 ) čestné vyhlásenie kúv , vyplýva : - > jekuv pvs - údaj kuv spoločník pvs zapísaný obchodnom registri byť správny , úplný aktuálne - > nepreviedol obchodný podiel pvs , základnom imaní ( časť ) iný osobu - nepreviedol iný osobu právo vyplatenie podiel zisku pvs - > nepreviedol iný osobu hlasovacie právo pvs - > nemať vedomosť skutočnostiach , iný osoba ovládala pvs spôsob $ 6a , ods ",majitel,0
405," — obchodný zákonník v platnom znení — zmluvy o tichom spoločenstve, 2) čestné vyhlásenie kúv, z ktorého vyplýva: - > jekuv pvs - všetky údaje kuv ako spoločníka pvs zapísané v obchodnom registri sú správne, úplné a aktuálne - > nepreviedol svoj obchodný podiel v pvs, ani na jeho základnom imaní (ani jeho časť) na inú osobu - nepreviedol na inú osobu svoje právo na vyplatenie podielu na zisku v pvs - > nepreviedol na inú osobu svoje hlasovacie právo v pvs - > nemá vedomosť o skutočnostiach, že by iná osoba ovládala pvs spôsobmi podľa $ 6a, ods"," c verejný funkcionár vlastnícky riadiacej štruktúra pvs pvs nemať vlastnícky riadiacej štruktúra verejný funkcionára vykonávajúceho funkcia slovenský republike , žiaden kuv pvs nie byť verejný funkcionárom vykonávajúcim funkcia slovenský republike ",majitel,0
406," c verejný funkcionár vo vlastníckej alebo riadiacej štruktúre pvs pvs nemá vo svojej vlastníckej alebo riadiacej štruktúre verejného funkcionára vykonávajúceho funkciu v slovenskej republike, žiaden z kuv pvs nie je verejným funkcionárom vykonávajúcim funkciu v slovenskej republike"," vyhlásenie os os vyhlasuje , identifikácii kuv pvs postupovala odborný starostlivosťou skutočnosť uvedený verifikačnom dokument zodpovedať skutočne zistenému stav os e ",majitel,0
407," vyhlásenie os os vyhlasuje, že pri identifikácii kuv pvs postupovala s odbornou starostlivosťou a všetky skutočnosti uvedené v tomto verifikačnom dokumente zodpovedajú skutočne zistenému stavu os e"," — zákon ochrane legalizácia príjem trestný činnosť ao ochrane financovaním terorizmus zmena doplnení zákon platnom znení , tvoriť prílohu návrh zápis pvs register pvs / overenie identifikácie kuv pvs ",majitel,0
408," — zákon o ochrane pred legalizáciou príjmov z trestnej činnosti ao ochrane pred financovaním terorizmu a o zmene a doplnení niektorých zákonov v platnom znení, a tvorí prílohu k návrhu na zápis pvs do registra pvs / overenie identifikácie kuv pvs", ,majitel,0
409," so sidlom : námestie slobody 39, 083 01 sabinov ičo: 46 186 484 spoločnosť zapísaná v obchodnom registri okresného súdu prešov, oddiel: sro, vložka číslo: 24475/p vmkuv kuv, konateľ (ďalej len „pvs“) 1) odôvodnenie, na základe akých informácií postupom podľa $ 11 odseku 4 zákona o registri pvs os overila identifikáciu kuv os identifikovala kuv pvs na základe údajov a informácií získaných z nasledovných dokumentov: - výpis zobchodného registra pvs, - znenie zakladateľskej listiny pvs zo dňa 05"," sidlom : námestie sloboda 39 , 083 01 sabinov ičo : 46 186 484 spoločnosť zapísaná obchodnom registri okresného súd prešov , oddiel : sro , vložka číslo : 24475/p vmkuv kuv , konateľ ( ďalej „ pvs “ ) 1 ) odôvodnenie , základ aký informácia postupom $ 11 odseku 4 zákon registri pvs os overila identifikácia kuv os identifikovala kuv pvs základ údajov informácia získaných nasledovný dokument : - výpis zobchodného register pvs , - znenie zakladateľskej listina pvs deň 05 ",majitel,0
410,"2017, ku ktorému boli zostavené účtovné podklady predložené os za účelom vykonania identifikácie kuv pvs neboli pvs alebo vo vzťahu k pvs vykonané akékoľvek úkony, najmä uzavreté alebo podstatne zmenené zmluvy (dohody), poskytnuté alebo prijaté plnenia, ktoré by významným spôsobom menili stav majetku a/alebo záväzkov pvs oproti stavu, vyplývajúcemu z účtovných podkladov predložených os za účelom vykonania identifikácie kuv pvs","2017 , byť zostavený účtovné podklady predložené os účelom vykonania identifikácie kuv pvs nebyť pvs vzťah pvs vykonané akýkoľvek úkony , najmä uzavreté podstatne zmenené zmluva ( dohoda ) , poskytnuté prijatý plnenia , významný spôsob meniť stav majetok a/alebo záväzkov pvs oproti stav , vyplývajúce účtovných podkladov predložených os účelom vykonania identifikácie kuv pvs ",majitel,0
411,"1 988, bytom uzovce 34, 082 66 uzovce 2) uvedenie vlastníckej štruktúry a riadiacej štruktúry pvs, ak je nímos jediným spoločníkom spoločnosti je: kuv, nar"," 03 . 1 988 , bytom uzovce 34 , 082 66 uzovce 2 ) uvedenie vlastnícky štruktúry riadiacej štruktúry pvs , byť nímos jediný spoločníkom spoločnosť byť : kuv , nar ",majitel,0
412," f) zákona o registri pvs, ak o nich os má alebo mohla mať vedomosť vrátane označenia verejnej funkcie: spoločník, konateľ ani kuv pvs nevykonáva funkciu verejných funkcionárov podľa čl"," 3 ) uvedenie údaja 8 4 ods . 3 písm . f ) zákon registri pvs , os mať mať vedomosť vrátane označenia verejný funkcia : spoločník , konateľ kuv pvs nevykonáva funkcia verejný funkcionár čl ",majitel,0
413," 4 zákona o registri pvs preukázanie, že podmienky na zápis vmkuv do registra pvs sú splnené: neaplikuje sa"," 4 ) prípad pvs $ 4 ods . 4 zákon registri pvs preukázanie , podmienka zápis vmkuv register pvs byť splnené : neaplikuje ",majitel,0
414," so sidlom : námestie slobody 39, 083 01 sabinov ičo: 46 186 484 spoločnosť zapísaná v obchodnom registri okresného súdu prešov, oddiel: sro, vložka číslo: 24475/p vmkuv kuv, konateľ (ďalej len „pvs“) 1) odôvodnenie, na základe akých informácií postupom podľa $ 11 odseku 4 zákona o registri pvs os overila identifikáciu kuv os identifikovala kuv pvs na základe údajov a informácií získaných z nasledovných dokumentov: - výpis zobchodného registra pvs, - znenie zakladateľskej listiny pvs zo dňa 05"," sidlom : námestie sloboda 39 , 083 01 sabinov ičo : 46 186 484 spoločnosť zapísaná obchodnom registri okresného súd prešov , oddiel : sro , vložka číslo : 24475/p vmkuv kuv , konateľ ( ďalej „ pvs “ ) 1 ) odôvodnenie , základ aký informácia postupom $ 11 odseku 4 zákon registri pvs os overila identifikácia kuv os identifikovala kuv pvs základ údajov informácia získaných nasledovný dokument : - výpis zobchodného register pvs , - znenie zakladateľskej listina pvs deň 05 ",majitel,0
415,"2017, ku ktorému boli zostavené účtovné podklady predložené os za účelom vykonania identifikácie kuv pvs neboli pvs alebo vo vzťahu k pvs vykonané akékoľvek úkony, najmä uzavreté alebo podstatne zmenené zmluvy (dohody), poskytnuté alebo prijaté plnenia, ktoré by významným spôsobom menili stav majetku a/alebo záväzkov pvs oproti stavu, vyplývajúcemu z účtovných podkladov predložených os za účelom vykonania identifikácie kuv pvs","2017 , byť zostavený účtovné podklady predložené os účelom vykonania identifikácie kuv pvs nebyť pvs vzťah pvs vykonané akýkoľvek úkony , najmä uzavreté podstatne zmenené zmluva ( dohoda ) , poskytnuté prijatý plnenia , významný spôsob meniť stav majetok a/alebo záväzkov pvs oproti stav , vyplývajúce účtovných podkladov predložených os účelom vykonania identifikácie kuv pvs ",majitel,0
416," f) zákona o registri pvs, ak o nich os má alebo mohla mať vedomosť vrátane označenia verejnej funkcie: spoločník, konateľ ani kuv pvs nevykonáva funkciu verejných funkcionárov podľa čl"," 3 ) uvedenie údaja 8 4 ods . 3 písm . f ) zákon registri pvs , os mať mať vedomosť vrátane označenia verejný funkcia : spoločník , konateľ kuv pvs nevykonáva funkcia verejný funkcionár čl ",majitel,0
417," 4 zákona o registri pvs preukázanie, že podmienky na zápis vmkuv do registra pvs sú splnené: neaplikuje sa"," 4 ) prípad pvs $ 4 ods . 4 zákon registri pvs preukázanie , podmienka zápis vmkuv register pvs byť splnené : neaplikuje ",majitel,0
418," spoločníci pvs vs: spoločníkom pvs vs je: kuv, adresa trvalého pobytu: hlaváčiková 3177/39, 841 05 bratislava — karlova ves, dátum narodenia: 02"," spoločníci pvs vs : spoločníkom pvs vs byť : kuv , adresa trvalého pobyt : hlaváčiková 3177/39 , 841 05 bratislava — karlova ves , dátum narodenie : 02 ",majitel,0
419,"6 vmkuv pvs vs, vmkuv pvs vs a spôsob konania vmkuv v mene pvs vs: podľa článku 8 odsek 1 zakladateľskej listiny je vmkuv pvs vs konateľ"," 1 . 6 vmkuv pvs vs , vmkuv pvs vs spôsob konania vmkuv mene pvs vs : článok 8 odsek 1 zakladateľskej listina byť vmkuv pvs vs konateľ ",majitel,0
420," konateľom pvs vs je: kuv, adresa trvalého pobytu: hlaváčiková 3177/39, 841 05 bratislava — karlova ves, dátum narodenia: 02"," konateľom pvs vs byť : kuv , adresa trvalého pobyt : hlaváčiková 3177/39 , 841 05 bratislava — karlova ves , dátum narodenie : 02 ",majitel,0
421,"1 na základe informácií vyplývajúcich z informácií a podkladov podľa článku iv tohto verifikačného dokumentu a v súlade s ustanovením 8 11 zorpvs v spojení s 8 6a zoaml, os identifikovala ako kuv nasledovnú osobu: kuv, adresa trvalého pobytu: hlaváčiková 3177/39, 841 05 bratislava — karlova ves, dátum narodenia: 02","1 základ informácia vyplývajúcich informácia podkladov článok iv verifikačného dokument súlad ustanovenie 8 11 zorpvs spojení 8 6a zoaml , os identifikovala kuv nasledovnú osobu : kuv , adresa trvalého pobyt : hlaváčiková 3177/39 , 841 05 bratislava — karlova ves , dátum narodenie : 02 ",majitel,0
422, predmet verifikačného dokumentu predmetom tohto verifikačného dokumentu je overenie identifikácie kuv pvs vs (ďalej ako len „kúv) podľa ustanovení 8 11 ods, predmet verifikačného dokument predmet verifikačného dokument byť overenie identifikácie kuv pvs vs ( ďalej „ kúv ) ustanovenie 8 11 ods ,majitel,0
423," odôvodnenie, informácie a podklady, na základe ktorých bola identifikovaná osoba kuv pvs vs s dôrazom na konanie s odbornou starostlivosťou si za účelom identifikácie kúv os zaobstarala, resp"," odôvodnenie , informácia podklady , základ byť identifikovaná osoba kuv pvs vs dôraz konanie odborný starostlivosťou účelom identifikácie kúv os zaobstarala , resp ",majitel,0
424,"2017, z ktorého vyplýva, že: — jekuv pvs vs, — všetky údaje týkajúce sa jej osoby ako spoločníka pvs vs zapísané v obchodnom registri sú úplné, správne a aktuálne, — nepreviedla svoj obchodný podiel (ani jeho časť) na inú osobu, — nepreviedla svoje právo na vyplatenie podielu zo zisku pvs vs na inú osobu, — nepreviedla svoje hlasovacie práva na inú osobu, — nieje verejným funkcionárom vykonávajúcim funkciu v slovenskej republike, — sa zaväzuje bezodkladne, najneskôr v lehote 15 dní, oznámiť pvs vs a os akékoľvek prípadné zmeny týkajúce vyššie prehlásených skutočností, — nemávedomosť o žiadnom inom spoločníkovi pvs vs, — pvs vs nemá tichého spoločníka a ani sám nie je tichým spoločníkom v inej spoločnosti, — nemá vedomosť o tom, že by iná osoba ovládala pvs vs spôsobmi podľa 8 6a ods","2017 , vyplýva , : — jekuv pvs vs , — údaj týkajúce osoba spoločník pvs vs zapísaný obchodnom registri byť úplný , správny aktuálne , — nepreviedla obchodný podiel ( časť ) iný osobu , — nepreviedla právo vyplatenie podiel zisku pvs vs iný osobu , — nepreviedla hlasovacie právo iný osobu , — nieje verejný funkcionárom vykonávajúcim funkcia slovenský republike , — zaväzovať bezodkladne , najneskôr lehote 15 deň , oznámiť pvs vs os akýkoľvek prípadné zmena týkajúce vysoko prehlásený skutočností , — nemávedomosť žiadny iný spoločníkovi pvs vs , — pvs vs nemať tichý spoločník sám nie byť tichým spoločníkom iný spoločnosť , — nemať vedomosť , iný osoba ovládala pvs vs spôsob 8 6a ods ",majitel,0
425,"6 vmkuv pvs vs, vmkuv pvs vs a spôsob konania vmkuv v mene pvs vs: podľa článku 8 odsek 1 zakladateľskej listiny je vmkuv pvs vs konateľ"," 1 . 6 vmkuv pvs vs , vmkuv pvs vs spôsob konania vmkuv mene pvs vs : článok 8 odsek 1 zakladateľskej listina byť vmkuv pvs vs konateľ ",majitel,0
426,"1975, trvale bytom severná 2812/55, 010 01 žilina, slovenská republika, štátny občan slovenskej republiky ako os sme vrámci výkonu identifikácií kuv postupovali v súlade s $ 11 zákona o rpvs, a to nasledovne: identifikácie kuv identifikácia kuv bola vykonaná a overená zobsahu nasledovných dokumentov: - spoločenská zmluva spoločnosti pvs, — výpis zobchodného registra spoločnosti pvs zo dňa 01","1975 , trvale bytom severná 2812/55 , 010 01 žilina , slovenský republika , štátny občan slovenský republika os byť vrámci výkon identifikácia kuv postupovali súlad $ 11 zákon rpvs , nasledovne : identifikácie kuv identifikácia kuv byť vykonaná overená zobsahu nasledovný dokument : - spoločenská zmluva spoločnosť pvs , — výpis zobchodného register spoločnosť pvs deň 01 ",majitel,0
427,"2018 (použiteľný na právne úkony), - doklad totožnosti spoločníkov spoločnosti akonateľov pvs, - prehlásenie kuv z obsahu vyššie uvedených listín vyplývajú nasledovné skutočnosti: spoločníkom pvs, spoločnosti pvs sú: kuv, nar","2018 ( použiteľný právny úkony ) , - doklad totožnosti spoločníkov spoločnosť akonateľov pvs , - prehlásenie kuv obsah vysoko uvedený listina vyplývať nasledovné skutočnosť : spoločníkom pvs , spoločnosť pvs byť : kuv , nar ",majitel,0
428," kuv pvs je: kuv, nar"," kuv pvs byť : kuv , nar ",majitel,0
429,"1975, trvale bytom severná 2812/55, 010 01 žilina, slovenská republika, štátny občan slovenskej republiky vlastnícku štruktúru pvs predstavujú jeho spoločníci, a to: kuv, nar","1975 , trvale bytom severná 2812/55 , 010 01 žilina , slovenský republika , štátny občan slovenský republika vlastnícku štruktúru pvs predstavovať spoločníci , : kuv , nar ",majitel,0
430,"500,00,- eur - splatené v celom rozsahu priamy podiel na základnom imaní pvs zodpovedajúci výške vkladu v percentuálnom vyjadrení: 50 % kuv, nar","500 ,00 , - eur - splatené celý rozsahu priamy podiel základnom imaní pvs zodpovedajúci výška vkladu percentuálnom vyjadrení : 50 % kuv , nar ",majitel,0
431,"500,00,- eur - splatené v celom rozsahu priamy podiel na základnom imaní pvs zodpovedajúci výške vkladu v percentuálnom vyjadrení: 50 % riadiacu štruktúru pvs predstavuje vmkuv vdanom prípade konatelia: kuv, nar","500 ,00 , - eur - splatené celý rozsahu priamy podiel základnom imaní pvs zodpovedajúci výška vkladu percentuálnom vyjadrení : 50 % riadiacu štruktúru pvs predstavovať vmkuv vdanom prípad konatelia : kuv , nar ",majitel,0
432," riadiacu struktriru pvs predstavuje vmkuv v danom prfpade konatelia: ,, mgr"," riadiacu struktriru pvs predstavovať vmkuv danom prfpade konatelia : , , mgr ",majitel,0
433,: 55876/l - štatutári: kuv kuv 2) os pvs ( podľa 8 z ods, : 55876/l - štatutári : kuv kuv 2 ) os pvs ( 8 ods ,majitel,0
434,"1975, trvale bytom severná 2812/55, 010 01 žilina, slovenská republika, štátny občan slovenskej republiky ako os sme vrámci výkonu identifikácií kuv postupovali v súlade s $ 11 zákona o rpvs, a to nasledovne: identifikácie kuv identifikácia kuv bola vykonaná a overená zobsahu nasledovných dokumentov: - spoločenská zmluva spoločnosti pvs, — výpis zobchodného registra spoločnosti pvs zo dňa 01","1975 , trvale bytom severná 2812/55 , 010 01 žilina , slovenský republika , štátny občan slovenský republika os byť vrámci výkon identifikácia kuv postupovali súlad $ 11 zákon rpvs , nasledovne : identifikácie kuv identifikácia kuv byť vykonaná overená zobsahu nasledovný dokument : - spoločenská zmluva spoločnosť pvs , — výpis zobchodného register spoločnosť pvs deň 01 ",majitel,0
435,"2018 (použiteľný na právne úkony), - doklad totožnosti spoločníkov spoločnosti akonateľov pvs, - prehlásenie kuv z obsahu vyššie uvedených listín vyplývajú nasledovné skutočnosti: spoločníkom pvs, spoločnosti pvs sú: kuv, nar","2018 ( použiteľný právny úkony ) , - doklad totožnosti spoločníkov spoločnosť akonateľov pvs , - prehlásenie kuv obsah vysoko uvedený listina vyplývať nasledovné skutočnosť : spoločníkom pvs , spoločnosť pvs byť : kuv , nar ",majitel,0
436," kuv pvs je: kuv, nar"," kuv pvs byť : kuv , nar ",majitel,0
437,"1975, trvale bytom orgovánová 197/1, 015 01 rajec, slovenská republika, štátny občan slovenskej republiky ako os sme vrámci výkonu identifikácií kuv postupovali v súlade s 8 11 zákona o rpvs, a to nasledovne: identifikácie kuv identifikácia kuv bola vykonaná a overená zobsahu nasledovných dokumentov: - zakladateľská listina spoločnosti gpp industrie bau, s","1975 , trvale bytom orgovánová 197/1 , 015 01 rajec , slovenský republika , štátny občan slovenský republika os byť vrámci výkon identifikácia kuv postupovali súlad 8 11 zákon rpvs , nasledovne : identifikácie kuv identifikácia kuv byť vykonaná overená zobsahu nasledovný dokument : - zakladateľská listina spoločnosť gpp industrie bau , ",majitel,0
438,"2018 (použiteľný na právne úkony), - doklad totožnosti spoločníka spoločnosti a konateľa pvs, - prehlásenie kuv z obsahu vyššie uvedených listín vyplývajú nasledovné skutočnosti: spoločníkom pvs, spoločnosti gpp industrie bau, s","2018 ( použiteľný právny úkony ) , - doklad totožnosti spoločník spoločnosť konateľa pvs , - prehlásenie kuv obsah vysoko uvedený listina vyplývať nasledovné skutočnosť : spoločníkom pvs , spoločnosť gpp industrie bau , ",majitel,0
439," kuv pvs je: kuv, nar"," kuv pvs byť : kuv , nar ",majitel,0
440," c) zákona o rpvs): verejní funkcionári vykonávajúci verejnú funkciu v sr vo vlastníckej a riadiacej štruktúre pvs verejného sektora vlastnícku štruktúru pvs predstavujú jeho spoločníci, a to: kuv, nar"," b ) zákon : ícka riadiaca š úra par ad 8 11 ods . 5 písm . c ) zákon rpvs ) : verejní funkcionári vykonávajúci verejnú funkcia sr vlastnícky riadiacej štruktúra pvs verejný sektor vlastnícku štruktúru pvs predstavovať spoločníci , : kuv , nar ",majitel,0
441,"638,783775,- eur - splatené v celom rozsahu priamy podiel na základnom imaní pvs zodpovedajúci výške vkladu v percentuálnom vyjadrení: 100 % riadiacu štruktúru pvs predstavuje vmkuv v danom prípade konateľ: kuv, nar","638 ,783775 , - eur - splatené celý rozsahu priamy podiel základnom imaní pvs zodpovedajúci výška vkladu percentuálnom vyjadrení : 100 % riadiacu štruktúru pvs predstavovať vmkuv danom prípad konateľ : kuv , nar ",majitel,0
442,"638,783775,- eur - splaten6 v celom rozsahu priamy podiel na zdkladnom imani pvs verein6ho sektora zodpovedaifci vf5ke vkladu v percentudlnom vyiadreniz loo o/o riadiacu struktriru pvs predstavuje vmkuv v danom prfpade konatel': patrik gailfir, nar","638 ,783775 , - eur - splaten6 celý rozsahu priamy podiel zdkladnom imani pvs verein6ho sektor zodpovedaifci vf5ke vkladu percentudlnom vyiadreniz loo o/o riadiacu struktriru pvs predstavovať vmkuv danom prfpade konatel ' : patrik gailfir , nar ",majitel,0
443,: 50597/l - štatutár: kuv — konateľ 2) os pvs ( podľa 8 2 ods, : 50597/l - štatutár : kuv — konateľ 2 ) os pvs ( 8 2 ods ,majitel,0
444,"1975, trvale bytom orgovánová 197/1, 015 01 rajec, slovenská republika, štátny občan slovenskej republiky ako os sme vrámci výkonu identifikácií kuv postupovali v súlade s 8 11 zákona o rpvs, a to nasledovne: identifikácie kuv identifikácia kuv bola vykonaná a overená zobsahu nasledovných dokumentov: - zakladateľská listina spoločnosti gpp industrie bau, s","1975 , trvale bytom orgovánová 197/1 , 015 01 rajec , slovenský republika , štátny občan slovenský republika os byť vrámci výkon identifikácia kuv postupovali súlad 8 11 zákon rpvs , nasledovne : identifikácie kuv identifikácia kuv byť vykonaná overená zobsahu nasledovný dokument : - zakladateľská listina spoločnosť gpp industrie bau , ",majitel,0
445,"2018 (použiteľný na právne úkony), - doklad totožnosti spoločníka spoločnosti a konateľa pvs, - prehlásenie kuv z obsahu vyššie uvedených listín vyplývajú nasledovné skutočnosti: spoločníkom pvs, spoločnosti gpp industrie bau, s","2018 ( použiteľný právny úkony ) , - doklad totožnosti spoločník spoločnosť konateľa pvs , - prehlásenie kuv obsah vysoko uvedený listina vyplývať nasledovné skutočnosť : spoločníkom pvs , spoločnosť gpp industrie bau , ",majitel,0
446," kuv pvs je: kuv, nar"," kuv pvs byť : kuv , nar ",majitel,0
447,": 31585/v základné imanie (zi) 6 639,00 eur rozsah splatenia zi 6 639,00 eur — | vlastnícka štruktúra pvs — spoločníci obchodné meno/ meno a kuv priezvisko a sídlo/bydlisko mlynská 626/19, 029 01 námestovo | 1ičo/dátum narodenia 07"," : 31585/v základný imanie ( zi ) 6 639 ,00 eur rozsah splatenie zi 6 639 ,00 eur — vlastnícka štruktúra pvs — spoločníci obchodné meno/ meno kuv priezvisko sídlo/bydlisko mlynská 626/19 , 029 01 námestovo 1ičo/dátum narodenie 07 ",majitel,0
