,Sentence,Tokenized,Class,Label
993, ," jilemnického 1955/32 , 960 01 zvolen štátna príslušnosť slovenský republika dátum narodenie 05 . októbra 1977 údaj byť kúv verejný funkcionárom nie byť kuv adresa pitelová 226 , 966 11 pitelová štátna príslušnosť slovenský republika dátum narodenie 3 . december 1963 údaj byť kúv verejný funkcionárom nie byť kuv adresa trnavská 1371/21 , 831 04 bratislava štátna príslušnosť slovenský republika dátum narodenie 28 . júna 1976 údaj byť kúv verejný funkcionárom nie byť článok verejní funkcionári štruktúrach pvs vlastnícky riadiacej štruktúra pvs nenachádza osoba vykonávajúca funkcia stanovenú čl ",statutar,0
994," o registri pvs a o zmene a doplnení niektorých zákonov v platnom znení (ďalej len „zákon o registri pvs“) os os, advokátka zapísaná v zozname advokátov vedenom sak pod číslom 3067 sídlo: bystrická 1029/101, 966 81 ţarnovica ičo: 00 625 701 (ďalej len „os na účely overenia identifikácie kuv pvs pri zmene kuv pvs pvs: obchodné meno: mestský podnik sluţieb ţarnovica s"," registri pvs zmena doplnení zákon platnom znení ( ďalej „ zákon registri pvs “ ) os os , advokátka zapísaná zozname advokátov vedenom sak číslo 3067 sídlo : bystrická 1029/101 , 966 81 ţarnovica ičo : 00 625 701 ( ďalej „ os účel overenia identifikácie kuv pvs zmena kuv pvs pvs : obchodné meno : mestský podnik sluţieb ţarnovica ",statutar,0
995," 15162/s zapísaný v registri pvs, číslo vloţky: 611 (ďalej len „pvs“ alebo aj len „pvs“ alebo „spoločnosť“) predmetom tohto verifikačného dokumentu je overenie identifikácie kuv (ďalej aj len „kúv“) pvs v súlade s ustanovením §11 ods"," 15162/s zapísaný registri pvs , číslo vloţky : 611 ( ďalej „ pvs “ „ pvs “ „ spoločnosť “ ) predmet verifikačného dokument byť overenie identifikácie kuv ( ďalej „ kúv “ ) pvs súlad ustanovenie §11 ods ",statutar,0
996," základné identifikačné údaje o pvs a zoznam podkladov, z ktorých sa vychádzalo pri overení identifikácie kuv os pri overení identifikácie kuv pvs na základe nasledovných informácií a nasledovným postupom určila kuv pvs: judr"," základný identifikačné údaj pvs zoznam podkladov , vychádzalo overení identifikácie kuv os overení identifikácie kuv pvs základ nasledovný informácia nasledovným postupom určiť kuv pvs : judr ",statutar,0
997," o vlastníkoch pvs, d) informáciu kto má právo vymenovať vmkuv riadiaci orgán, dozorný orgán alebo kontrolný orgán v pvs, alebo akéhokoľvek jeho člena, e) informáciu, či je tu iná osoba ako vlastník pvs, ktorá má právo vymenovať vmkuv riadiaci orgán, dozorný orgán, alebo kontrolný orgán v pvs, ktorá skutočne ovláda pvs, t","eu telefonický kontakt : +421 915 893 777 2 1 . os prvotne preverila pravdivosť úplnosť informácia zapísaný obchodnom registri registri pvs pvs , preverila nasledujúce údaj : ) identifikačné údaj pvs rozsahu obchodné meno , sídlo , ičo , označenie úradného register iný úradnej evidencie , byť pvs zapísaný , číslo zápisu register evidencie , b ) meno , priezvisko , rodné číslo , dátum narodenie , adresa trvalého pobyt , iný pobyt , štátny príslušnosť , doklad totoţnosti osoba oprávnených konať mene pvs spôsob konania mene pvs , c ) rovnaký údaj byť uvedený písm . b ) bodu 1 . vlastníkoch pvs , d ) informácia mať právo vymenovať vmkuv riadiaci orgán , dozorný orgán kontrolný orgán pvs , akýkoľvek člen , e ) informácia , byť iný osoba vlastník pvs , mať právo vymenovať vmkuv riadiaci orgán , dozorný orgán , kontrolný orgán pvs , skutočne ovláda pvs , t ",statutar,0
998,"2017, číslo vloţky: 611 a teda registrovaný v registri pvs v zmysle ustanovenia § 22 zákona o registri pvs, ako osoba zapísaná v registri kuv podľa osobitného predpisu, pričom na účely zákona o registri pvs sa povaţuje za pvs","2017 , číslo vloţky : 611 registrovaný registri pvs zmysel ustanovenie § 22 zákon registri pvs , osoba zapísaná registri kuv osobitný predpisu , pričom účel zákon registri pvs povaţuje pvs ",statutar,0
999," os zistila, ţe u pvs došlo k zmene vmkuv a tak pristúpila k overeniu identifikácie kuv pvs"," os zistiť , ţe u pvs dôjsť zmena vmkuv pristúpila overeniu identifikácie kuv pvs ",statutar,0
1000, 4 zákona o registri pvs bola overená identifikácia kuv (kúv) judr," overenie identifikácie kuv odôvodnenie , základ aký informácia postupom § 11 ods . 4 zákon registri pvs byť overená identifikácia kuv ( kúv ) judr ",statutar,0
1001,"eu telefonický kontakt: +421 915 893 777 7  nie je verejným funkcionárom vykonávajúcim funkciu v slovenskej republike;  pvs nemá tichého spoločníka a ani on sám nie je tichým spoločníkom v inej spoločnosti;  nie je spoločníkom v inej spoločnosti, v ktorej by iná fyzická osoba získala postavenie kuv pvs na základe práva na hospodársky prospech z podnikania či inej činnosti pvs, alebo ktorá by ovládala pvs iným spôsobom vyplývajúcim zo vzájomných zmlúv alebo dohôd, ktorými by boli upravené vzájomné trhové recipročné plnenia, ktoré by pre ňu znamenali nepriamy podiel na hospodárskom prospechu pvs vo výške najmenej 25% z podnikania pvs alebo z inej jeho činnosti","eu telefonický kontakt : +421 915 893 777 7  nie byť verejný funkcionárom vykonávajúcim funkcia slovenský republike ;  pvs nemať tichý spoločník sám nie byť tichým spoločníkom iný spoločnosť ;  nie byť spoločníkom iný spoločnosť , iný fyzický osoba získať postavenie kuv pvs základ právo hospodársky prospech podnikanie iný činnosť pvs , ovládala pvs iný spôsob vyplývajúcim vzájomný zmlúv dohôd , byť upravený vzájomné trhový recipročné plnenia , znamenali nepriamy podiel hospodárskom prospechu pvs výška najmenej 25 % podnikanie pvs iný činnosť ",statutar,0
1002," vo vlastníckej štruktúre pvs sa neuvádza, pričom os bolo zistené z oficiálnej internetovej stránky mesta ţarnovica, ako aj čestným vyhlásením jediného spoločníka spoločnosti potvrdené, ţe vmkuv jediného spoločníka spoločnosti je kamil danko, adresa trvalého pobytu: májová 288/18, 966 81 ţarnovica, dátum narodenia: 07"," údaj § 4 ods . 3 písm . f ) zákon registri pvs , mať mať os vedomosť vrátane označenia verejný funkcia ( zoznam verejný funkcionár vykonávajúcich funkcia slovenský republike , byť súčasť vlastnícky štruktúry riadiacej štruktúry pvs ) 1 . vlastnícky štruktúra pvs neuvádza , pričom os byť zistené oficiálny internetová stránky mesto ţarnovica , čestným vyhláseniem jediný spoločník spoločnosť potvrdené , ţe vmkuv jediný spoločník spoločnosť byť kamil danko , adresa trvalého pobyt : májová 288/18 , 966 81 ţarnovica , dátum narodenie : 07 ",statutar,0
1003," o registri pvs a o zmene a doplnení niektorých zákonov v platnom znení (ďalej len „zákon o registri pvs“) os os, advokátka zapísaná v zozname advokátov vedenom sak pod číslom 3067 sídlo: bystrická 1029/101, 966 81 ţarnovica ičo: 00 625 701 (ďalej len „os na účely overenia identifikácie kuv pvs pri zmene kuv pvs pvs: obchodné meno: mestský podnik sluţieb ţarnovica s"," registri pvs zmena doplnení zákon platnom znení ( ďalej „ zákon registri pvs “ ) os os , advokátka zapísaná zozname advokátov vedenom sak číslo 3067 sídlo : bystrická 1029/101 , 966 81 ţarnovica ičo : 00 625 701 ( ďalej „ os účel overenia identifikácie kuv pvs zmena kuv pvs pvs : obchodné meno : mestský podnik sluţieb ţarnovica ",statutar,0
1004," 15162/s zapísaný v registri pvs, číslo vloţky: 611 (ďalej len „pvs“ alebo aj len „pvs“ alebo „spoločnosť“) predmetom tohto verifikačného dokumentu je overenie identifikácie kuv (ďalej aj len „kúv“) pvs v súlade s ustanovením §11 ods"," 15162/s zapísaný registri pvs , číslo vloţky : 611 ( ďalej „ pvs “ „ pvs “ „ spoločnosť “ ) predmet verifikačného dokument byť overenie identifikácie kuv ( ďalej „ kúv “ ) pvs súlad ustanovenie §11 ods ",statutar,0
1005," základné identifikačné údaje o pvs a zoznam podkladov, z ktorých sa vychádzalo pri overení identifikácie kuv os pri overení identifikácie kuv pvs na základe nasledovných informácií a nasledovným postupom určila kuv pvs: judr"," základný identifikačné údaj pvs zoznam podkladov , vychádzalo overení identifikácie kuv os overení identifikácie kuv pvs základ nasledovný informácia nasledovným postupom určiť kuv pvs : judr ",statutar,0
1006," o vlastníkoch pvs, d) informáciu kto má právo vymenovať vmkuv riadiaci orgán, dozorný orgán alebo kontrolný orgán v pvs, alebo akéhokoľvek jeho člena, e) informáciu, či je tu iná osoba ako vlastník pvs, ktorá má právo vymenovať vmkuv riadiaci orgán, dozorný orgán, alebo kontrolný orgán v pvs, ktorá skutočne ovláda pvs, t","eu telefonický kontakt : +421 915 893 777 2 1 . os prvotne preverila pravdivosť úplnosť informácia zapísaný obchodnom registri registri pvs pvs , preverila nasledujúce údaj : ) identifikačné údaj pvs rozsahu obchodné meno , sídlo , ičo , označenie úradného register iný úradnej evidencie , byť pvs zapísaný , číslo zápisu register evidencie , b ) meno , priezvisko , rodné číslo , dátum narodenie , adresa trvalého pobyt , iný pobyt , štátny príslušnosť , doklad totoţnosti osoba oprávnených konať mene pvs spôsob konania mene pvs , c ) rovnaký údaj byť uvedený písm . b ) bodu 1 . vlastníkoch pvs , d ) informácia mať právo vymenovať vmkuv riadiaci orgán , dozorný orgán kontrolný orgán pvs , akýkoľvek člen , e ) informácia , byť iný osoba vlastník pvs , mať právo vymenovať vmkuv riadiaci orgán , dozorný orgán , kontrolný orgán pvs , skutočne ovláda pvs , t ",statutar,0
1007,"2017, číslo vloţky: 611 a teda registrovaný v registri pvs v zmysle ustanovenia § 22 zákona o registri pvs, ako osoba zapísaná v registri kuv podľa osobitného predpisu, pričom na účely zákona o registri pvs sa povaţuje za pvs","2017 , číslo vloţky : 611 registrovaný registri pvs zmysel ustanovenie § 22 zákon registri pvs , osoba zapísaná registri kuv osobitný predpisu , pričom účel zákon registri pvs povaţuje pvs ",statutar,0
1008," os zistila, ţe u pvs došlo k zmene vmkuv a tak pristúpila k overeniu identifikácie kuv pvs"," os zistiť , ţe u pvs dôjsť zmena vmkuv pristúpila overeniu identifikácie kuv pvs ",statutar,0
1009," z čestného vyhlásenia spoločnosti vyplýva, ţe osoby identifikované ako kuv pvs nie sú verejnými funkcionármi vykonávajúcimi funkciu v slovenskej republike v zmysle ustanovenia čl"," 2 . čestný vyhlásenie spoločnosť vyplýva , ţe osoba identifikované kuv pvs nie byť verejnými funkcionármi vykonávajúcimi funkcia slovenský republike zmysel ustanovenie čl ",statutar,0
1010, dôvodom na overenie identifikácie kuv pvs podľa bodu 1, vmkuv prokurista vedúci zamestnanec priamy riadiacej pôsobnosť vmkuv 4 . dôvod overenie identifikácie kuv pvs bodu 1 ,statutar,0
1011,"eu telefonický kontakt: +421 915 893 777 7  nie je verejným funkcionárom vykonávajúcim funkciu v slovenskej republike;  pvs nemá tichého spoločníka a ani on sám nie je tichým spoločníkom v inej spoločnosti;  nie je spoločníkom v inej spoločnosti, v ktorej by iná fyzická osoba získala postavenie kuv pvs na základe práva na hospodársky prospech z podnikania či inej činnosti pvs, alebo ktorá by ovládala pvs iným spôsobom vyplývajúcim zo vzájomných zmlúv alebo dohôd, ktorými by boli upravené vzájomné trhové recipročné plnenia, ktoré by pre ňu znamenali nepriamy podiel na hospodárskom prospechu pvs vo výške najmenej 25% z podnikania pvs alebo z inej jeho činnosti","eu telefonický kontakt : +421 915 893 777 7  nie byť verejný funkcionárom vykonávajúcim funkcia slovenský republike ;  pvs nemať tichý spoločník sám nie byť tichým spoločníkom iný spoločnosť ;  nie byť spoločníkom iný spoločnosť , iný fyzický osoba získať postavenie kuv pvs základ právo hospodársky prospech podnikanie iný činnosť pvs , ovládala pvs iný spôsob vyplývajúcim vzájomný zmlúv dohôd , byť upravený vzájomné trhový recipročné plnenia , znamenali nepriamy podiel hospodárskom prospechu pvs výška najmenej 25 % podnikanie pvs iný činnosť ",statutar,0
1012," 5 zákona zapíše vmkuv pvs vmkuv pvs je: a) kuv, konateľ, nar"," veronika pázmányová , advokátka prokuristka ( ďalej „ os súlad 8 6a zákon ochrane legalizácia os zistiť , namiesto kuv pvs register pvs feľeľe| ( - esp ods . 5 zákon zapíše vmkuv pvs vmkuv pvs byť : ) kuv , konateľ , nar ",statutar,0
1013," konateľom pvs je kuv, ktorý je oprávnený zastupovať pvs samostatne"," konateľom pvs byť kuv , byť oprávnený zastupovať pvs samostatne ",statutar,0
1014,"7 zhrnutie na základe vyššie uvedeného, ako aj poskytnutých informácií, príslušných dotazníkov, čestných vyhlásení, dokumentov predložených zo strany pvs a verejne dostupných informácií, os zistila, že pvs je nepriamo výlučne ovládaný emitentom cenných papierov, spoločnosťou ntt data corporation, ktorá podlieha požiadavkám na uverejňovanie informácií feľeľe | f- medzinárodných noriem a preto sa namiesto kuv pvs do registra pvs podľa 8 4 ods","7 zhrnutie základ vysoko uvedeného , poskytnutý informácia , príslušný dotazníkov , čestných vyhlásení , dokument predložených strana pvs verejne dostupný informácia , os zistiť , pvs byť nepriamo výlučne ovládaný emitentom cenných papier , spoločnosť ntt data corporation , podlieha požiadavka uverejňovanie informácia feľeľe f- medzinárodný noriem namiesto kuv pvs register pvs 8 4 ods ",statutar,0
1015," v rámci vlastníckej a riad acej štruktúry pvs nepôsobia osoby ktoré sú v zmysle čl 2 ods 1 zákona o verejných funkcionárov považované za verejných funkcionárov pvs s ňa podmienky na zápis vmkuv namiesto kuv pvs pretože ntt data corporation ako jediná osoba, ktorá pvs nepriamo výlučne ovláda je emitentom cenných papierov prijatých na obchodovanie na regulovanom trhu, ktorý podlieha požiadavkám na uverejňovanie informácií podľa medzinárodných noriem"," rámec vlastnícky riad acej štruktúry pvs nepôsobia osoba byť zmysel čl 2 ods 1 zákon verejný funkcionár považovaný verejný funkcionár pvs ňa podmienka zápis vmkuv namiesto kuv pvs ntt data corporation jediný osoba , pvs nepriamo výlučne ovláda byť emitentom cenných papier prijatých obchodovanie regulovanom trh , podlieha požiadavka uverejňovanie informácia medzinárodný noriem ",statutar,0
1016," os vyhlasuje, že pri identifikáci kuv pvs postupova a nestranne, s odbornou starostlivosťou a všetky skutočnosti uvedené v tomto verifikačnom dokumente zodpovedajú ňou zistenému skutočnému stavu nazielusten 2021 € cm ľe [a áazmányová advokátka a ristka verejní funkcionári vo vlastníckej alebo riadiacej štruktúre pvs splnenie podmienok na zápis vmkuv v prípade emitenta cenných papierov prijatých na obchodovanie na regulovanom trhu vyhlásenie os verrfrkacruy ooxument podl'a $ 11 ods"," os vyhlasuje , identifikáci kuv pvs postupova nestranne , odborný starostlivosťou skutočnosť uvedený verifikačnom dokument zodpovedať zistenému skutočnému stav nazielusten 2021 € cm ľe [a áazmányová advokátka ristka verejní funkcionári vlastnícky riadiacej štruktúra pvs splnenie podmienka zápis vmkuv prípad emitenta cenných papier prijatých obchodovanie regulovanom trh vyhlásenie os verrfrkacruy ooxument podl'a $ 11 ods ",statutar,0
1017," 5 zlkona zapi5e vmkuv pvs vmkuv pvs je: a) vladimir hudadin, konatel', nar"," veron ika p azm1nyovs , advok6tka prokuristka ( d' alej , , os s0lade $ 6a zakona ochrane legaliz6ciou os zistiť , ze namiesto kuv pvs register pvs podl'a $ 4 ods . 5 zlkona zapi5e vmkuv pvs vmkuv pvs byť : ) vladimir hudadin , konatel ' , nar ",statutar,0
1018,"7 zhrnutie na z6klade vyssie uveden6ho, ako aj poskytnutfch informdcii, prislu5nfch dotaznikov, destnfch vyhl6seni, dokumentov predlozenyich zo strany pvs averejne dostupnlich informdcii, os zistila, 2e pvs je nepriamo vfludne ovl6dani emitentom cennfch papierov, spolodnost'ou ntt 'data corporation, ktord podlieha poziadavkdm na uverejfiovanie inform6cii podl'a medzindrodnyich noriem a preto sa namiesto kuv pvs do registra pvs podl'a $ 4 ods", 1 . pvs 2 . ldentifik6cia kuv pvs 1 ,statutar,0
1019, verejni funkciond ri vo vlastnickej alebo riadiacej strukture pvs splnenie pod emitenta cenn mienok na z6pis vmkuv v pripade fch papierov prijatfch na obchodovanie na regulovanom trhu 5 6," 3 . 7 zhrnutie z6klade vyssie uveden6ho , poskytnutfch informdcii , prislu5nfch dotaznikov , destnfch vyhl6seni , dokument predlozenyich strana pvs averejne dostupnlich informdcii , os zistiť , 2e pvs byť nepriamo vfludne ovl6dani emitentom cennfch papier , spolodnost'ou ntt ' data corporation , ktord podlieha poziadavkdm uverejfiovanie inform6cii podl'a medzindrodnyich noriem namiesto kuv pvs register pvs podl'a $ 4 ods ",statutar,0
1020," 9677/b vmkuv kuv, konateľ (ďalej len „pvs obchodné meno: glatzová 8 co", azm1nyova ristka 4 . verejni funkciond ri vlastnicke riadiacej strukture pvs splnenie emitenta cenn mienok z6pis vmkuv pripade fch papier prijatfch obchodovanie regulovanom trh 5 6 ,statutar,0
1021," veronika pázmányová, advokátka a prokuristka (ďalej len „os v súlade s 8 6a zákona o ochrane pred legalizáciou os zistila, že namiesto kuv pvs sa do registra pvs feľeľe|(- esp ods"," 9677/b vmkuv kuv , konateľ ( ďalej „ pvs obchodné meno : glatzová 8 co ",statutar,0
1022," 5 zákona zapíše vmkuv pvs vmkuv pvs je: a) kuv, konateľ, nar"," veronika pázmányová , advokátka prokuristka ( ďalej „ os súlad 8 6a zákon ochrane legalizácia os zistiť , namiesto kuv pvs register pvs feľeľe| ( - esp ods . 5 zákon zapíše vmkuv pvs vmkuv pvs byť : ) kuv , konateľ , nar ",statutar,0
1023, identifikácia kuv pvs 3, os 2 . identifikácia kuv pvs 3 . vlastnícka riadiaca štruktúra pvs odôvodnenie 3 ,statutar,0
1024," konateľom pvs je kuv, ktorý je oprávnený zastupovať pvs samostatne"," konateľom pvs byť kuv , byť oprávnený zastupovať pvs samostatne ",statutar,0
1025,"7 zhrnutie na základe vyššie uvedeného, ako aj poskytnutých informácií, príslušných dotazníkov, čestných vyhlásení, dokumentov predložených zo strany pvs a verejne dostupných informácií, os zistila, že pvs je nepriamo výlučne ovládaný emitentom cenných papierov, spoločnosťou ntt data corporation, ktorá podlieha požiadavkám na uverejňovanie informácií feľeľe | f- medzinárodných noriem a preto sa namiesto kuv pvs do registra pvs podľa 8 4 ods","7 zhrnutie základ vysoko uvedeného , poskytnutý informácia , príslušný dotazníkov , čestných vyhlásení , dokument predložených strana pvs verejne dostupný informácia , os zistiť , pvs byť nepriamo výlučne ovládaný emitentom cenných papier , spoločnosť ntt data corporation , podlieha požiadavka uverejňovanie informácia feľeľe f- medzinárodný noriem namiesto kuv pvs register pvs 8 4 ods ",statutar,0
1026," v rámci vlastníckej a riad acej štruktúry pvs nepôsobia osoby ktoré sú v zmysle čl 2 ods 1 zákona o verejných funkcionárov považované za verejných funkcionárov pvs s ňa podmienky na zápis vmkuv namiesto kuv pvs pretože ntt data corporation ako jediná osoba, ktorá pvs nepriamo výlučne ovláda je emitentom cenných papierov prijatých na obchodovanie na regulovanom trhu, ktorý podlieha požiadavkám na uverejňovanie informácií podľa medzinárodných noriem"," rámec vlastnícky riad acej štruktúry pvs nepôsobia osoba byť zmysel čl 2 ods 1 zákon verejný funkcionár považovaný verejný funkcionár pvs ňa podmienka zápis vmkuv namiesto kuv pvs ntt data corporation jediný osoba , pvs nepriamo výlučne ovláda byť emitentom cenných papier prijatých obchodovanie regulovanom trh , podlieha požiadavka uverejňovanie informácia medzinárodný noriem ",statutar,0
1027," os vyhlasuje, že pri identifikáci kuv pvs postupova a nestranne, s odbornou starostlivosťou a všetky skutočnosti uvedené v tomto verifikačnom dokumente zodpovedajú ňou zistenému skutočnému stavu nazielusten 2021 € cm ľe [a áazmányová advokátka a ristka verejní funkcionári vo vlastníckej alebo riadiacej štruktúre pvs splnenie podmienok na zápis vmkuv v prípade emitenta cenných papierov prijatých na obchodovanie na regulovanom trhu vyhlásenie os verrfrkacruy ooxument podl'a $ 11 ods"," os vyhlasuje , identifikáci kuv pvs postupova nestranne , odborný starostlivosťou skutočnosť uvedený verifikačnom dokument zodpovedať zistenému skutočnému stav nazielusten 2021 € cm ľe [a áazmányová advokátka ristka verejní funkcionári vlastnícky riadiacej štruktúra pvs splnenie podmienka zápis vmkuv prípad emitenta cenných papier prijatých obchodovanie regulovanom trh vyhlásenie os verrfrkacruy ooxument podl'a $ 11 ods ",statutar,0
1028,":967718 vmkuv vladimir hudadin, konatel' (d'alej len,,pvs obchodn6 meno: glatzovi & co"," :967718 vmkuv vladimir hudadin , konatel ' ( d' alej , , pvs obchodn6 meno : glatzovi & co ",statutar,0
1029," veron ika p azm1nyovs, advok6tka a prokuristka (d'alej len,,os v s0lade s $ 6a zakona o ochrane pred legaliz6ciou os zistila, ze namiesto kuv pvs sa do registra pvs podl'a $ 4 ods"," veron ika p azm1nyovs , advok6tka prokuristka ( d' alej , , os s0lade $ 6a zakona ochrane legaliz6ciou os zistiť , ze namiesto kuv pvs register pvs podl'a $ 4 ods . 5 zlkona zapi5e vmkuv pvs vmkuv pvs byť : ) vladimir hudadin , konatel ' , nar ",statutar,0
1030," 5 zlkona zapi5e vmkuv pvs vmkuv pvs je: a) vladimir hudadin, konatel', nar", 1 . pvs 2 . ldentifik6cia kuv pvs 1 ,statutar,0
1031, ldentifik6cia kuv pvs 1," 3 . 7 zhrnutie z6klade vyssie uveden6ho , poskytnutfch informdcii , prislu5nfch dotaznikov , destnfch vyhl6seni , dokument predlozenyich strana pvs averejne dostupnlich informdcii , os zistiť , 2e pvs byť nepriamo vfludne ovl6dani emitentom cennfch papier , spolodnost'ou ntt ' data corporation , ktord podlieha poziadavkdm uverejfiovanie inform6cii podl'a medzindrodnyich noriem namiesto kuv pvs register pvs podl'a $ 4 ods ",statutar,0
1032,"7 zhrnutie na z6klade vyssie uveden6ho, ako aj poskytnutfch informdcii, prislu5nfch dotaznikov, destnfch vyhl6seni, dokumentov predlozenyich zo strany pvs averejne dostupnlich informdcii, os zistila, 2e pvs je nepriamo vfludne ovl6dani emitentom cennfch papierov, spolodnost'ou ntt 'data corporation, ktord podlieha poziadavkdm na uverejfiovanie inform6cii podl'a medzindrodnyich noriem a preto sa namiesto kuv pvs do registra pvs podl'a $ 4 ods"," ickej acej rdmci vlastn ad ri stru pa n rt era bia sri re kt'lry nep6so dl 2 osoba zmysel zakon nkcion fu arov ve nfch verej fun kci rov povazovan6 relnich vmkuv namiesto kuv pvs pretoze ntt data corporation jedina osoba , ktord pvs nepriamo vfludne ovl6da byť emitentom cennich papier prijatfch obchodovanie regulovanom trh , ktoni podlieha poziad-avk6m uverejiovanie informscii podl'a medzindrodnlich noriem ",statutar,0
1033," ickej acej rdmci v vlastn a ad ri stru pa n rt era bia kto sri re v kt'lry nep6so dl 2 osoby zmysle zakon i a s od o nkcion fu arov ve za nfch verej fun ona kci rov povazovan6 relnich na vmkuv namiesto kuv pvs pretoze ntt data corporation ako jedina osoba, ktord pvs nepriamo vfludne ovl6da je emitentom cennich papierov prijatfch na obchodovanie na regulovanom trhu, ktoni podlieha poziad-avk6m na uverejiovanie informscii podl'a medzindrodnlich noriem", ,statutar,0
1034,"000 eur podoba akcie: listinná druh akcie: akcia na meno celkový podiel na základnom imaní pvs: 99 % orgány spoločnosti: podľa dostupných informácii sú orgánmi pvs (i) valné zhromaždenia, ako najvyšší orgán spoločnosti, (ii) vmkuv spoločnosti a (iii) dozorná rada","000 eur podoba akcie : listinná druh akcie : akcia meno celkový podiel základnom imaní pvs : 99 % orgán spoločnosť : dostupný informácii byť orgán pvs ( ) valné zhromaždenie , najvyšší orgán spoločnosť , ( ii ) vmkuv spoločnosť ( iii ) dozorná rád ",statutar,0
1035," a) zákona o ochrane pred legalizáciou príjmov z tč, je možné uzavrieť, že za kuv sa považujú vmkuv pvs a preto vyššie uvedená fyzická osoba napĺňa definíciu kuv v zmysle ust"," vzhľad zverejnené informácia , jednoznačne vyplýva , žiaden fyzický osoba nespĺňa kritérium uvedený § 6a ods . 1 písm . ) zákon ochrane legalizácia príjem tč , byť možný uzavrieť , kuv považujú vmkuv pvs vysoko uvedený fyzický osoba napĺňa definícium kuv zmysel ust ",statutar,0
1036," východiskové informácie za účelom identifikácie kuv (ďalej len „kúv“) boli os zaobstarané nasledovné dokumenty vyplnené a predložené zo strany pvs: a) výpis z obchodného registra slovenskej republiky spoločnosti pvs platný ku dňu podpisu tohto verifikačného dokumentu, b) úplné znenie stanov spoločnosti pvs, ku dňu 01"," východiskové informácia účelom identifikácie kuv ( ďalej „ kúv “ ) byť os zaobstarané nasledovné dokument vyplnený predložené strana pvs : ) výpis obchodný register slovenský republika spoločnosť pvs platný dňu podpis verifikačného dokument , b ) úplný znenie stanov spoločnosť pvs , dňu 01 ",statutar,0
